{
    "name": "Yoga Studio Software",
    "urlSlug": "yogastudios",
    "softwareName": "Kursverwaltung",
    "menuLabel": "Yoga Studios",
    "menuIcon": "MenuBarIcon",
    "menuIconAlt": "Lotusblüten Icon Symbol für Yoga Studios und Meditation",
    "iconColor": "#8B5CF6",
    "metaTitle": "Yoga Studio Software: Kurse, Retreats und Termine online verwalten",
    "navBarTitle": "Yoga Studio Software",
    "demoButtonLabel": "Demo öffnen",
    "metaDescription": "Das Buchungssystem für Yoga Studios: Automatisiere Klassen, Workshops & Retreats. Teilnehmerverwaltung & Wartelisten leicht gemacht. Inkl. E-Rechnung.",
    "heroSection": {
        "heroImage": "HeroImage",
        "heroImageAlt": "Entspannte Teilnehmer in einem Yoga-Kurs im Shavasana und bei der Meditation",
        "title1": "Yoga Studio Software",
        "title2": "für mehr Flow im Business",
        "convertTitle": "Demo öffnen",
        "convertDescription": "Erhalte deinen Link zur kostenlosen Yoga-Studio Demo.",
        "convertActionTitle": "Demo öffnen",
        "benefits": [
            "Yoga-Klassen & Retreats 24/7 online buchen",
            "Wartelisten füllen Matten automatisch",
            "Gutscheine & 10er-Karten einfach verwalten",
            "E-Rechnung & Buchhaltung stressfrei"
        ]
    },
    "newFeaturesSection": {
        "sectionTitle": { "strong": "Studio-Funktionen", "text": "testen" },
        "sectionSubtitle": "Entdecke alle Tools für dein Yoga Business",
        "heading": "Features,<br> die dein Studio entspannen",
        "description": "Die Butlerapp Funktionen arbeiten <strong>im Hintergrund</strong>, damit du dich auf das Wichtigste konzentrieren kannst: Deine Schüler und die Praxis.",
        "convertTitle": "Demo öffnen",
        "convertDescription": "Erhalte deinen Link zur kostenlosen Yoga-Studio Demo.",
        "convertActionTitle": "Demo öffnen",
        "features": [
            {
                "title": "Buchungsformular",
                "featuresList": [
                    { "name": "Warenkorb für mehrere Klassen", "icon": "BuchungsformularIcon01" },
                    { "name": "Kursgebühr direkt online zahlen", "icon": "BuchungsformularIcon02" },
                    { "name": "Design passend zum Studio", "icon": "BuchungsformularIcon03" },
                    { "name": "Auto-Bestätigung & Namasté", "icon": "BuchungsformularIcon04" },
                    { "name": "Anmeldung für Retreats", "icon": "BuchungsformularIcon05" },
                    { "name": "Haftungsausschluss akzeptieren", "icon": "BuchungsformularIcon06" },
                    { "name": "Wordpress Kurs-Plugin", "icon": "BuchungsformularIcon07" },
                    { "name": "Wix Integration", "icon": "BuchungsformularIcon15" },
                    { "name": "Typo3 Integration", "icon": "BuchungsformularIcon08" },
                    { "name": "Joomla Integration", "icon": "BuchungsformularIcon09" },
                    { "name": "Stundenplan-Übersicht", "icon": "BuchungsformularIcon10" },
                    { "name": "Abfrage von Verletzungen", "icon": "BuchungsformularIcon11" },
                    { "name": "Ratenzahlung für Teacher Training", "icon": "BuchungsformularIcon12" },
                    { "name": "Integration in Studio-Webseite", "icon": "BuchungsformularIcon13" },
                    { "name": "Eigene Kurs-Webseite erstellen", "icon": "BuchungsformularIcon14" }
                ]
            },
            {
                "title": "Rabatte & Gutscheine",
                "featuresList": [
                    { "name": "Early-Bird für Retreats", "icon": "RabatteGutscheineIcon01" },
                    { "name": "Upselling (z.B. Yogamatten)", "icon": "RabatteGutscheineIcon02" },
                    { "name": "Links für Influencer / Partner", "icon": "RabatteGutscheineIcon03" },
                    { "name": "Geschenkgutscheine verkaufen", "icon": "RabatteGutscheineIcon04" }
                ]
            },
            {
                "title": "Teilnehmer-Verwaltung",
                "featuresList": [
                    {
                        "name": "Check-in Listen für Lehrer",
                        "icon": "TeilnehmerBuchungsverwaltungIcon01"
                    },
                    {
                        "name": "Stornos & Umbuchen managen",
                        "icon": "TeilnehmerBuchungsverwaltungIcon02"
                    },
                    {
                        "name": "Infos für Retreat-Teilnehmer",
                        "icon": "TeilnehmerBuchungsverwaltungIcon03"
                    },
                    {
                        "name": "Teilnahme-Zertifikate senden",
                        "icon": "TeilnehmerBuchungsverwaltungIcon05"
                    }
                ]
            },
            {
                "title": "Kunden-Verwaltung",
                "featuresList": [
                    { "name": "Schnellsuche für Buchungen", "icon": "KundenVerwaltungIcon01" },
                    { "name": "Schüler-Kartei mit Historie", "icon": "KundenVerwaltungIcon02" },
                    { "name": "Infos an Kursteilnehmer", "icon": "KundenVerwaltungIcon03" },
                    { "name": "Daten exportieren & importieren", "icon": "KundenVerwaltungIcon04" },
                    { "name": "Stammkunden schnell buchen", "icon": "KundenVerwaltungIcon05" }
                ]
            },
            {
                "title": "Rechnungs-Wesen",
                "featuresList": [
                    { "name": "Rechnungen für Workshops", "icon": "RechnungsWesenIcon01" },
                    { "name": "Export für den Steuerberater", "icon": "RechnungsWesenIcon02" },
                    { "name": "Einfache Beleg-Korrektur", "icon": "RechnungsWesenIcon03" },
                    { "name": "Auto-Abgleich mit Bankkonto", "icon": "RechnungsWesenIcon04" },
                    { "name": "Mahnwesen bei Zahlungsverzug", "icon": "RechnungsWesenIcon05" },
                    { "name": "Stornorechnung erstellen", "icon": "RechnungsWesenIcon06" },
                    { "name": "Zahlungseingang bestätigen", "icon": "RechnungsWesenIcon07" },
                    { "name": "Auto-Erinnerung bei Offenen Posten", "icon": "RechnungsWesenIcon08" },
                    { "name": "GoBD-konforme Buchführung", "icon": "RechnungsWesenIcon09" },
                    { "name": "Direkte DATEV Schnittstelle", "icon": "RechnungsWesenIcon10" },
                    { "name": "Lexoffice Verbindung", "icon": "RechnungsWesenIcon11" },
                    { "name": "Reverse Charge (Ausland)", "icon": "RechnungsWesenIcon12" },
                    { "name": "E-Rechnung bereit", "icon": "RechnungsWesenIcon13" }
                ]
            },
            {
                "title": "Automatisierung",
                "featuresList": [
                    {
                        "name": "Erinnerung vor Yoga-Klasse",
                        "icon": "AutomatisierungsmoeglichkeitenIcon01"
                    },
                    {
                        "name": "Automatische Mahnung",
                        "icon": "AutomatisierungsmoeglichkeitenIcon02"
                    },
                    {
                        "name": "Zahlungserinnerung senden",
                        "icon": "AutomatisierungsmoeglichkeitenIcon03"
                    },
                    {
                        "name": "Mail vor Retreat-Start (Infos)",
                        "icon": "AutomatisierungsmoeglichkeitenIcon04"
                    },
                    {
                        "name": "Mail nach Workshop (Dank)",
                        "icon": "AutomatisierungsmoeglichkeitenIcon05"
                    },
                    {
                        "name": "Geburtstagsgrüße an Yogis",
                        "icon": "AutomatisierungsmoeglichkeitenIcon06"
                    },
                    {
                        "name": "Ausbildungs-Zertifikate per Mail",
                        "icon": "AutomatisierungsmoeglichkeitenIcon07"
                    },
                    {
                        "name": "Sofort-Versand Gutscheine",
                        "icon": "AutomatisierungsmoeglichkeitenIcon08"
                    },
                    { "name": "Auto-Bankabgleich", "icon": "AutomatisierungsmoeglichkeitenIcon09" },
                    {
                        "name": "Warteliste füllt freie Plätze",
                        "icon": "AutomatisierungsmoeglichkeitenIcon10"
                    }
                ]
            },
            {
                "title": "Bezahlmöglichkeiten",
                "featuresList": [
                    { "name": "SEPA Lastschrift", "icon": "SepaLogo" },
                    { "name": "Visa", "icon": "VisaLogo" },
                    { "name": "MasterCard", "icon": "MasterCardLogo" },
                    { "name": "Vorkasse Überweisung", "icon": "VorkasseLogo" },
                    { "name": "PayPal", "icon": "PaypalLogo" },
                    { "name": "Apple Pay", "icon": "ApplePayLogo" },
                    { "name": "Twint", "icon": "TwintLogo" },
                    { "name": "EPS Überweisung", "icon": "EPSLogo" },
                    { "name": "Google Pay", "icon": "GooglePayLogo" },
                    { "name": "Klarna", "icon": "KlarnaLogo" },
                    { "name": "GiroPay", "icon": "GiroPayLogo" },
                    { "name": "PaySafe", "icon": "PaySafeCardLogo" }
                ]
            },
            {
                "title": "Administration",
                "featuresList": [
                    { "name": "Zugriffsrechte für Yogalehrer", "icon": "AdministrationIcon01" },
                    { "name": "Kursleiter verwalten", "icon": "AdministrationIcon02" },
                    { "name": "DSGVO-konformer Datenschutz", "icon": "AdministrationIcon03" }
                ]
            }
        ]
    },
    "aboutCourse": {